{
  "$schema": "../schemas/trackSelectCatalog.schema.json",
  "id": "human-psychscreen",
  "label": "PsychSCREEN",
  "description": "PsychSCREEN browser tracks",
  "views": [
    {
      "id": "default",
      "label": "Default",
      "columns": [
        {
          "field": "title",
          "label": "Title",
          "width": 240
        },
        {
          "field": "category",
          "label": "Category",
          "width": 180
        },
        {
          "field": "subcategory",
          "label": "Subcategory",
          "width": 240
        },
        {
          "field": "trackType",
          "label": "Track Type",
          "width": 120
        }
      ],
      "grouping": [
        "category",
        "subcategory"
      ],
      "leaf": "title"
    }
  ],
  "tracks": [
    {
      "type": "bigbed",
      "id": "human-psychscreen/epigenetic/adult-bcres",
      "title": "Adult candidate brain cis-Regulatory Elements (b-cCREs)",
      "display": "dense",
      "height": 30,
      "color": "#9479bc",
      "config": {
        "url": "gs://gcp.wenglab.org/GTEx-psychscreen/tracks/data/adult_bCREs.bigBed"
      },
      "metadata": {
        "sourceId": "epigenetic/adult-bcres",
        "category": "Epigenetic Tracks",
        "subcategory": "Candidate cis-Regulatory Elements",
        "trackType": "bigbed"
      }
    },
    {
      "type": "bigbed",
      "id": "human-psychscreen/epigenetic/fetal-bcres",
      "title": "Fetal candidate brain cis-Regulatory Elements (b-cCREs)",
      "display": "dense",
      "height": 30,
      "color": "#9479bc",
      "config": {
        "url": "gs://gcp.wenglab.org/GTEx-psychscreen/tracks/data/fetal_bCREs.bigBed"
      },
      "metadata": {
        "sourceId": "epigenetic/fetal-bcres",
        "category": "Epigenetic Tracks",
        "subcategory": "Candidate cis-Regulatory Elements",
        "trackType": "bigbed"
      }
    },
    {
      "type": "bigbed",
      "id": "human-psychscreen/epigenetic/encode-ccres-all-tissues",
      "title": "ENCODE cCREs, all tissues",
      "display": "dense",
      "height": 30,
      "color": "#9479bc",
      "config": {
        "url": "gs://gcp.wenglab.org/GRCh38-cCREs.V4.bigBed"
      },
      "metadata": {
        "sourceId": "epigenetic/encode-ccres-all-tissues",
        "category": "Epigenetic Tracks",
        "subcategory": "Candidate cis-Regulatory Elements",
        "trackType": "bigbed"
      }
    },
    {
      "type": "bigwig",
      "id": "human-psychscreen/epigenetic/fans-all-neun-plus",
      "title": "all brain regions, aggregated NeuN+",
      "display": "full",
      "height": 50,
      "color": "#9479bc",
      "config": {
        "url": "gs://gcp.wenglab.org/GTEx-psychscreen/tracks/data/all-NeuN+-ATAC.bigWig"
      },
      "metadata": {
        "sourceId": "epigenetic/fans-all-neun-plus",
        "category": "Epigenetic Tracks",
        "subcategory": "PsychENCODE neuron/non-neuron FANS-sorted ATAC-seq (healthy donors)",
        "trackType": "bigwig"
      }
    },
    {
      "type": "bigwig",
      "id": "human-psychscreen/epigenetic/fans-all-neun-minus",
      "title": "all brain regions, aggregated NeuN-",
      "display": "full",
      "height": 50,
      "color": "#9479bc",
      "config": {
        "url": "gs://gcp.wenglab.org/GTEx-psychscreen/tracks/data/all-NeuN--ATAC.bigWig"
      },
      "metadata": {
        "sourceId": "epigenetic/fans-all-neun-minus",
        "category": "Epigenetic Tracks",
        "subcategory": "PsychENCODE neuron/non-neuron FANS-sorted ATAC-seq (healthy donors)",
        "trackType": "bigwig"
      }
    },
    {
      "type": "bigwig",
      "id": "human-psychscreen/epigenetic/fans-dlpfc-neun-plus",
      "title": "dorsolateral prefrontal cortex NeuN+",
      "display": "full",
      "height": 50,
      "color": "#9479bc",
      "config": {
        "url": "gs://gcp.wenglab.org/GTEx-psychscreen/tracks/data/DLPFC-NeuN+-healthy-ATAC.bigWig"
      },
      "metadata": {
        "sourceId": "epigenetic/fans-dlpfc-neun-plus",
        "category": "Epigenetic Tracks",
        "subcategory": "PsychENCODE neuron/non-neuron FANS-sorted ATAC-seq (healthy donors)",
        "trackType": "bigwig"
      }
    },
    {
      "type": "bigwig",
      "id": "human-psychscreen/epigenetic/fans-dlpfc-neun-minus",
      "title": "dorsolateral prefrontal cortex NeuN-",
      "display": "full",
      "height": 50,
      "color": "#9479bc",
      "config": {
        "url": "gs://gcp.wenglab.org/GTEx-psychscreen/tracks/data/DLPFC-NeuN--healthy-ATAC.bigWig"
      },
      "metadata": {
        "sourceId": "epigenetic/fans-dlpfc-neun-minus",
        "category": "Epigenetic Tracks",
        "subcategory": "PsychENCODE neuron/non-neuron FANS-sorted ATAC-seq (healthy donors)",
        "trackType": "bigwig"
      }
    },
    {
      "type": "bigwig",
      "id": "human-psychscreen/epigenetic/fans-fppfc-neun-plus",
      "title": "frontopolar prefrontal cortex NeuN+",
      "display": "full",
      "height": 50,
      "color": "#9479bc",
      "config": {
        "url": "gs://gcp.wenglab.org/GTEx-psychscreen/tracks/data/FPPFC-NeuN+-healthy-ATAC.bigWig"
      },
      "metadata": {
        "sourceId": "epigenetic/fans-fppfc-neun-plus",
        "category": "Epigenetic Tracks",
        "subcategory": "PsychENCODE neuron/non-neuron FANS-sorted ATAC-seq (healthy donors)",
        "trackType": "bigwig"
      }
    },
    {
      "type": "bigwig",
      "id": "human-psychscreen/epigenetic/fans-fppfc-neun-minus",
      "title": "frontopolar prefrontal cortex NeuN-",
      "display": "full",
      "height": 50,
      "color": "#9479bc",
      "config": {
        "url": "gs://gcp.wenglab.org/GTEx-psychscreen/tracks/data/FPPFC-NeuN--healthy-ATAC.bigWig"
      },
      "metadata": {
        "sourceId": "epigenetic/fans-fppfc-neun-minus",
        "category": "Epigenetic Tracks",
        "subcategory": "PsychENCODE neuron/non-neuron FANS-sorted ATAC-seq (healthy donors)",
        "trackType": "bigwig"
      }
    },
    {
      "type": "bigwig",
      "id": "human-psychscreen/epigenetic/fans-hipp-neun-plus",
      "title": "hippocampus NeuN+",
      "display": "full",
      "height": 50,
      "color": "#9479bc",
      "config": {
        "url": "gs://gcp.wenglab.org/GTEx-psychscreen/tracks/data/HIPP-NeuN+-healthy-ATAC.bigWig"
      },
      "metadata": {
        "sourceId": "epigenetic/fans-hipp-neun-plus",
        "category": "Epigenetic Tracks",
        "subcategory": "PsychENCODE neuron/non-neuron FANS-sorted ATAC-seq (healthy donors)",
        "trackType": "bigwig"
      }
    },
    {
      "type": "bigwig",
      "id": "human-psychscreen/epigenetic/fans-hipp-neun-minus",
      "title": "hippocampus NeuN-",
      "display": "full",
      "height": 50,
      "color": "#9479bc",
      "config": {
        "url": "gs://gcp.wenglab.org/GTEx-psychscreen/tracks/data/HIPP-NeuN--healthy-ATAC.bigWig"
      },
      "metadata": {
        "sourceId": "epigenetic/fans-hipp-neun-minus",
        "category": "Epigenetic Tracks",
        "subcategory": "PsychENCODE neuron/non-neuron FANS-sorted ATAC-seq (healthy donors)",
        "trackType": "bigwig"
      }
    },
    {
      "type": "bigwig",
      "id": "human-psychscreen/epigenetic/fans-ins-neun-plus",
      "title": "insular cortex NeuN+",
      "display": "full",
      "height": 50,
      "color": "#9479bc",
      "config": {
        "url": "gs://gcp.wenglab.org/GTEx-psychscreen/tracks/data/INS-NeuN+-healthy-ATAC.bigWig"
      },
      "metadata": {
        "sourceId": "epigenetic/fans-ins-neun-plus",
        "category": "Epigenetic Tracks",
        "subcategory": "PsychENCODE neuron/non-neuron FANS-sorted ATAC-seq (healthy donors)",
        "trackType": "bigwig"
      }
    },
    {
      "type": "bigwig",
      "id": "human-psychscreen/epigenetic/fans-ins-neun-minus",
      "title": "insular cortex NeuN-",
      "display": "full",
      "height": 50,
      "color": "#9479bc",
      "config": {
        "url": "gs://gcp.wenglab.org/GTEx-psychscreen/tracks/data/INS-NeuN--healthy-ATAC.bigWig"
      },
      "metadata": {
        "sourceId": "epigenetic/fans-ins-neun-minus",
        "category": "Epigenetic Tracks",
        "subcategory": "PsychENCODE neuron/non-neuron FANS-sorted ATAC-seq (healthy donors)",
        "trackType": "bigwig"
      }
    },
    {
      "type": "bigwig",
      "id": "human-psychscreen/epigenetic/fans-itc-neun-plus",
      "title": "inferior temporal gyrus NeuN+",
      "display": "full",
      "height": 50,
      "color": "#9479bc",
      "config": {
        "url": "gs://gcp.wenglab.org/GTEx-psychscreen/tracks/data/ITC-NeuN+-healthy-ATAC.bigWig"
      },
      "metadata": {
        "sourceId": "epigenetic/fans-itc-neun-plus",
        "category": "Epigenetic Tracks",
        "subcategory": "PsychENCODE neuron/non-neuron FANS-sorted ATAC-seq (healthy donors)",
        "trackType": "bigwig"
      }
    },
    {
      "type": "bigwig",
      "id": "human-psychscreen/epigenetic/fans-itc-neun-minus",
      "title": "inferior temporal gyrus NeuN-",
      "display": "full",
      "height": 50,
      "color": "#9479bc",
      "config": {
        "url": "gs://gcp.wenglab.org/GTEx-psychscreen/tracks/data/ITC-NeuN--healthy-ATAC.bigWig"
      },
      "metadata": {
        "sourceId": "epigenetic/fans-itc-neun-minus",
        "category": "Epigenetic Tracks",
        "subcategory": "PsychENCODE neuron/non-neuron FANS-sorted ATAC-seq (healthy donors)",
        "trackType": "bigwig"
      }
    },
    {
      "type": "bigwig",
      "id": "human-psychscreen/epigenetic/fans-mdt-neun-plus",
      "title": "mediodorsal thalamic nucleus NeuN+",
      "display": "full",
      "height": 50,
      "color": "#9479bc",
      "config": {
        "url": "gs://gcp.wenglab.org/GTEx-psychscreen/tracks/data/MDT-NeuN+-healthy-ATAC.bigWig"
      },
      "metadata": {
        "sourceId": "epigenetic/fans-mdt-neun-plus",
        "category": "Epigenetic Tracks",